### ISSUE TITLE
Restore from backup fails at postgres

### ISSUE THREAD

**Issue by dottodot** [flynn/flynn#2731]
with the error

```
wait postgres-wait error: discoverd: timed out waiting for instances
```
debug info https://gist.github.com/anonymous/54ebe124db5013889ee8db6da6007f2d

`flynn-host fix --min-hosts 3` gives another error of

```
 error getting status from postgres leader error="Get http://100.100.41.2:5433/status: dial tcp 100.100.41.2:5433: i/o timeout"
panic: runtime error: invalid memory address or nil pointer dereference [recovered]
	panic: runtime error: invalid memory address or nil pointer dereference
```

**Comment by titanous** [comment]
Do you have a firewall/security group configured?

**Comment by dottodot** [comment]
Yes I've set it the same as all the other times I've done it. I purposing wrote myself a guide to make sure they are setup correctly each time.

**Comment by titanous** [comment]
Please try pinging these IPs from the host that you ran the debug-info command on: 100.100.41.0, 100.100.41.1, 100.100.70.0, 100.100.70.1

**Comment by dottodot** [comment]
They all ping ok

**Comment by titanous** [comment]
Okay, please try curling these URLs from each host:

```text
http://100.100.70.2:5433/status
http://100.100.41.2:5433/status
http://100.100.10.2:5433/status
```

**Comment by dottodot** [comment]
Ok 

node1 this is the only one that has a response http://100.100.10.2:5433/status
node 2 http://100.100.70.2:5433/status http://100.100.10.2:5433/status work
node 3 http://100.100.70.2:5433/status http://100.100.10.2:5433/status work

**Comment by titanous** [comment]
Okay, triple check your firewall config for UDP traffic between hosts. It looks like cluster communication over the VXLAN overlay network is not fully working. You can use tcpdump to check whether traffic is making it between hosts.

**Comment by dottodot** [comment]
So should I be able to curl all 3?

**Comment by titanous** [comment]
Yeah, ideally, but there may be something wrong with the 41.2 process at this point. The fact that you can't get to 70.2 from one node but can from the others is telling.

**Comment by dottodot** [comment]
OK I'm now at a complete lose. I'm pretty sure I've done everything the same as last time I created a new cluster but it's not working. Just tried from scratch again with the same result. My firewall is as per below.

![screen shot 2016-04-22 at 20 02 21](https://cloud.githubusercontent.com/assets/811652/14752028/dff23a2a-08c4-11e6-9192-8bce3b853375.png)

The only thing I can think that is different is I've now an additional drive so that I can set up the storage but from what you've said I can't see that being related.

**Comment by titanous** [comment]
I'd suggest running tcpdump (for example, `tcpdump -i flannel.1`) on two hosts and then trying to make the relevant requests between them, checking if the packets are tunneled correctly. Everything I've seen points to a firewall issue, but if the packets are not being blocked we can look at other explanations.

**Comment by dottodot** [comment]
Unfortunately is a bit beyond me 

Node 1 output is
```
19:21:30.560567 IP 100.100.10.0.48949 > 100.100.98.8.5433: Flags [P.], seq 153029:153166, ack 11018089, win 1444, options [nop,nop,TS val 1904497 ecr 1903948], length 137
19:21:30.560989 IP 100.100.98.8.5433 > 100.100.10.0.48949: Flags [.], seq 11018089:11020885, ack 153166, win 1452, options [nop,nop,TS val 1903974 ecr 1904497], length 2796
19:21:30.561050 IP 100.100.98.8.5433 > 100.100.10.0.48949: Flags [P.], seq 11020885:11022185, ack 153166, win 1452, options [nop,nop,TS val 1903974 ecr 1904497], length 1300
19:21:30.561096 IP 100.100.98.8.5433 > 100.100.10.0.48949: Flags [.], seq 11022185:11024981, ack 153166, win 1452, options [nop,nop,TS val 1903974 ecr 1904497], length 2796
19:21:30.561157 IP 100.100.98.8.5433 > 100.100.10.0.48949: Flags [.], seq 11024981:11027777, ack 153166, win 1452, options [nop,nop,TS val 1903974 ecr 1904497], length 2796
19:21:30.561197 IP 100.100.98.8.5433 > 100.100.10.0.48949: Flags [P.], seq 11027777:11027946, ack 153166, win 1452, options [nop,nop,TS val 1903974 ecr 1904497], length 169
19:21:30.561255 IP 100.100.98.8.5433 > 100.100.10.0.48949: Flags [P.], seq 11027946:11027953, ack 153166, win 1452, options [nop,nop,TS val 1903974 ecr 1904497], length 7
19:21:30.561800 IP 100.100.10.0.48949 > 100.100.98.8.5433: Flags [.], ack 11020885, win 1444, options [nop,nop,TS val 1904498 ecr 1903974], length 0
19:21:30.561867 IP 100.100.10.0.48949 > 100.100.98.8.5433: Flags [.], ack 11027946, win 1409, options [nop,nop,TS val 1904498 ecr 1903974], length 0
19:21:30.562010 IP 100.100.10.0.48949 > 100.100.98.8.5433: Flags [.], ack 11027953, win 1444, options [nop,nop,TS val 1904498 ecr 1903974], length 0
```  
Node 2 is
```
19:21:27.031135 IP 100.100.73.0.58294 > 100.100.98.6.5433: Flags [P.], seq 155632:155769, ack 11205505, win 1444, options [nop,nop,TS val 1898146 ecr 1903071], length 137
19:21:27.032651 IP 100.100.98.6.5433 > 100.100.73.0.58294: Flags [.], seq 11205505:11206903, ack 155769, win 1452, options [nop,nop,TS val 1903097 ecr 1898146], length 1398
19:21:27.032659 IP 100.100.98.6.5433 > 100.100.73.0.58294: Flags [.], seq 11206903:11208301, ack 155769, win 1452, options [nop,nop,TS val 1903097 ecr 1898146], length 1398
19:21:27.032693 IP 100.100.98.6.5433 > 100.100.73.0.58294: Flags [P.], seq 11208301:11209601, ack 155769, win 1452, options [nop,nop,TS val 1903097 ecr 1898146], length 1300
19:21:27.032696 IP 100.100.98.6.5433 > 100.100.73.0.58294: Flags [.], seq 11209601:11210999, ack 155769, win 1452, options [nop,nop,TS val 1903097 ecr 1898146], length 1398
19:21:27.032755 IP 100.100.73.0.58294 > 100.100.98.6.5433: Flags [.], ack 11210999, win 1424, options [nop,nop,TS val 1898147 ecr 1903097], length 0
```

**Comment by dottodot** [comment]
Firewall issues were resolved with the help from this post https://github.com/flynn/flynn/issues/1485

One other issue though was it seemed to get stuck at `restore-postgres restore` but the restore seemed to complete OK.

**Comment by dottodot** [comment]
OK so restore doesn't seem to work. It gets to `restore-postgres restore` and then hangs at this point.

May well be the same issue as https://github.com/flynn/flynn/issues/2642 only I'm not get as far

Debug info is
Node 1 https://gist.github.com/anonymous/16a5c5307a10727965a3a5b4d4ce3774
Node 2 https://gist.github.com/68a844ec1f96a85e0e82e1b632099085
Node 3 https://gist.github.com/17bc062bf2053fc7a2ec585f508edc65

**Comment by dottodot** [comment]
Scrape that it did restore after I left it a while. It's just a bit disconcerting the way hangs. Don't remember it doing this last time I did a restore.

**Comment by titanous** [comment]
It's not hanging, it's restoring data. Each release has a compiled artifact in the blobstore. We're working on garbage collection so that backups are not so large.

**Comment by titanous** [comment]
It sounds like this was resolved?

**Comment by dottodot** [comment]
yep
