### ISSUE TITLE
Questions regarding logging and formats

### ISSUE THREAD

**Issue by RobinDaugherty** [flynn/flynn#3858]
I'm struggling with getting logs from Flynn and the applications we have running in it. I've been able to use log-sink to send logs to Papertrail, but using Logentries results in a bunch of run-together lines that it's unable to parse, and for some reason I can't get log-sink to work with LogDNA at all.

LogDNA's agent is able to monitor entire directories and does a great job of shipping logs from the files written in `/var/log`, but Flynn's log filenames and log entries have no application name, only process IDs.

The log-sink feature is new and poorly documented. What format is the `prefix` supposed to be in? How do we determine the state of a sink?

**Comment by lmars** [comment]
@RobinDaugherty 

> using Logentries results in a bunch of run-together lines that it's unable to parse

Can you give an example of what is going wrong there? Flynn sends each log line as an [RFC 5424 formatted](https://tools.ietf.org/html/rfc5424#page-8) syslog message framed using "octet counting" as per [RFC 6587](https://tools.ietf.org/html/rfc6587#section-3.4.1), is that supported by Logentries?

> I can't get log-sink to work with LogDNA at all

Are the messages making it through? Are you getting any errors? Any information you can provide would be useful.

> LogDNA's agent is able to monitor entire directories and does a great job of shipping logs from the files written in /var/log, but Flynn's log filenames and log entries have no application name, only process IDs.

Yes this is exactly why we implemented the log sink feature, the on-disk logs use app IDs so you can translate them to app names (they don't change once created), but it would be much better to get the log sinks working.

> What format is the prefix supposed to be in?

The prefix is a string which is prefixed to the `MSG` section of the resulting syslog messages.

For example:

```
$ flynn cluster log-sink add syslog syslog://example.com:55514 'foobar'
```

results in:

```
<0>1 2017-01-21T00:42:49.488587766Z host0 dashboard web.host0-841f585b-d49e-4c04-b6c1-943895cd52ce ID1 [flynn seq="1816"] foobar t=2017-01-21T00:42:49+0000 lvl=info msg="request started" component=dashboard req_id=490dedf3-7bc9-452c-af07-d946aff137bd method=GET path=/ client_ip=100.100.56.14
<0>1 2017-01-21T00:42:49.488653252Z host0 dashboard web.host0-841f585b-d49e-4c04-b6c1-943895cd52ce ID1 [flynn seq="1817"] foobar t=2017-01-21T00:42:49+0000 lvl=info msg="request completed" component=dashboard req_id=490dedf3-7bc9-452c-af07-d946aff137bd status=200 duration=124.523µs
<0>1 2017-01-21T00:42:51.488589145Z host0 dashboard web.host0-841f585b-d49e-4c04-b6c1-943895cd52ce ID1 [flynn seq="1818"] foobar t=2017-01-21T00:42:51+0000 lvl=info msg="request started" component=dashboard req_id=5e9bd1b8-f6c2-401b-85cf-9c550794d876 method=GET path=/ client_ip=100.100.56.14
<0>1 2017-01-21T00:42:51.488633992Z host0 dashboard web.host0-841f585b-d49e-4c04-b6c1-943895cd52ce ID1 [flynn seq="1819"] foobar t=2017-01-21T00:42:51+0000 lvl=info msg="request completed" component=dashboard req_id=5e9bd1b8-f6c2-401b-85cf-9c550794d876 status=200 duration=113.024µs
```

This is useful for example if you need to include a token in all of your messages.

> How do we determine the state of a sink?

You can list the sinks on a host with `flynn-host log-sink list <host>`:

```
$ flynn-host log-sink list host0
ID                                    KIND           CONFIG                                                                                       HOST MANAGED
100.100.56.13:514                     logaggregator  {"addr":"100.100.56.13:514"}                                                                 true
e40a0308-dd21-4d31-97e8-77d54d58f949  syslog         {"url":"syslog://example.com:55514","template":"foobar","use_ids":false,"insecure":false}    false
```

We definitely need to improve documentation in this area.

**Comment by lmars** [comment]
I took a look at Logentries and it seems they only support [non-transparent-framing](https://tools.ietf.org/html/rfc6587#section-3.4.2) (i.e. newline separated syslog messages).

We should expose this as a formatting option in the log sink configuration.

**Comment by lmars** [comment]
A conversation with Mike at LogDNA suggests the logs should make it through:

> Hey, do you support syslog messages framed using "octet counting" as per RFC 6587? https://tools.ietf.org/html/rfc6587#section-3.4.1
> I work on Flynn (open source PaaS) which sends logs to third parties using that style of framing, just want to know if you support it

> Yes, our syslog server will actually try to do its best to sniff for the style of framing used during transport. So you should be good to use either method.

**Comment by RobinDaugherty** [comment]
Thanks for your help! Sorry, I should have provided more detail.

With Logentries the problem is that all of the lines flow together until it reaches some preset limit. Where the frame terminator would be, they have the string "<0>" (or at least that's what's visible in the UI). I have a bug opened with Logentries and they say they're working on a fix.

With LogDNA, no entries are being received at all. It could be the same issue manifesting differently. But it could be a problem with DNS resolution or connections being refused.

It's clear to me how to add, list, and remove log sinks, but determining their status is where I'm hung up. How can I find out whether a sink is working? Is there a queue that will back up if the host can't be reached? Could I see how far behind it is?

**Comment by lmars** [comment]
Ah ok, so the only status you can currently get on log sinks is whether there was an error connecting by looking in `/var/log/flynn/flynn-host.log`, for example:

```
$ grep -F 'component=logmux' /var/log/flynn/flynn-host.log
...
t=2017-01-21T01:30:17+0000 lvl=info msg="connecting to sink" app=host pid=5648 host.id=host0 component=logmux fn=addSink
t=2017-01-21T01:30:17+0000 lvl=eror msg="error connecting to sink" app=host pid=5648 host.id=host0 component=logmux fn=addSink err="dial tcp example.com:55514: getsockopt: connection refused"
...
```

> Is there a queue that will back up if the host can't be reached?

All logs are stored on disk with sequential identifiers (limited to 200MB per app), and when a connection is made to a log sink, those on-disk logs are replayed and a cursor is updated for that sink, so the on disk logs are effectively the queue.

> Could I see how far behind it is?

Flynn doesn't currently expose the sink cursor position, but it wouldn't be too much work to expose that.

**Comment by lmars** [comment]
FYI Logentries came back to me and confirmed they only accept newline delimited syslog messages:

> Octet counting is not currently supported, as we accept logs from a near infinite list of sources, many not conforming to syslog spec, hence the newline delimiting.
>
> For stacktraces, we offer client libraries that'd format these accordingly - in case they're within a syslog stream, log types can be applied in UI to delimit by regex pattern (i.e timestamp).
>
> Incoming syslog messages would however have to be delimited by newline at source.

**Comment by RobinDaugherty** [comment]
That makes sense. I was trying to set up a pattern in Logentries to break apart the entries, and it wasn't working. The bug they discussed with me is apparently related to using a pattern to delimit entries. I will update here once I hear back and hopefully provide a working pattern to use with Logentries.

**Comment by RobinDaugherty** [comment]
LogDNA is now working, they had to fix a little bug. (As a side note, it took about 90 minutes from reporting the issue (with a tcpdump) to having the fix deployed. For troubleshooting syslog protocol issues in the future, the [instructions here](http://help.papertrailapp.com/kb/configuration/troubleshooting-remote-syslog-reachability/#test-tcpdump) were very helpful in creating a tcpdump to send them.

**Comment by josephglanville** [comment]
Awesome. Our code does use the entire feature set of the syslog protocol so it doesn't surprise me it uncovers bugs. :)

I have also PR'd a change for supporting non-RFC6587 compliant providers too as it's probably going to be a common request.

**Comment by mikehu** [comment]
We (LogDNA) are working with Robin to try and resolve his issues with ingestion. From what I can see from our end, the octet counter seems to be providing a bad value (consistently 2 short of the actual length).

From what I can see from our side, here's some sample input:
```
273 <0>1 2017-01-24T20:36:02.028836475Z flynn01.omnib.net postgres postgres.flynn01.omnib.net-a08097c3-88f1-409c-9552-1218c1a3694d ID2 [flynn seq=\"34565\"] dd66bdba-db3a-48b8-8acc-54f39330a400 2017-01-24 20:36:02.028 UTC LOG:  connection authorized: user=flynn database=postgres
271 <0>1 2017-01-24T20:36:02.097518559Z flynn01.omnib.net postgres postgres.flynn01.omnib.net-a08097c3-88f1-409c-9552-1218c1a3694d ID2 [flynn seq=\"34566\"] dd66bdba-db3a-48b8-8acc-54f39330a400 2017-01-24 20:36:02.097 UTC LOG:  connection received: host=***.***.**.0 port=45098
297 <0>1 2017-01-24T20:36:02.099935119Z flynn01.omnib.net postgres postgres.flynn01.omnib.net-a08097c3-88f1-409c-9552-1218c1a3694d ID2 [flynn seq=\"34567\"] dd66bdba-db3a-48b8-8acc-54f39330a400 2017-01-24 20:36:02.099 UTC LOG:  connection authorized: user=flynn database=53c06a8f3d5c8e5dd941178d8c2e2cb2
344 <0>1 2017-01-24T20:36:02.291868639Z flynn01.omnib.net postgres postgres.flynn01.omnib.net-a08097c3-88f1-409c-9552-1218c1a3694d ID2 [flynn seq=\"34568\"] dd66bdba-db3a-48b8-8acc-54f39330a400 2017-01-24 20:36:02.291 UTC LOG:  disconnection: session time: 0:00:00.194 user=flynn database=53c06a8f3d5c8e5dd941178d8c2e2cb2 host=***.***.**.0 port=45098
```

The *'s actually represent IP's which I've redacted but kept the length.

If you actually count the character lengths for each of those lines they seem to be consistently short by 2. It seems to be indicating the message is shorter than it actually is? Perhaps this is something you guys can check on your side?

**Comment by lmars** [comment]
@mikehu it looks like somewhere on your end the quotes are being escaped (e.g. in `[flynn seq=\"34565\"]`) which is adding two extra bytes.

I created my own LogDNA account (lewis@flynn.io) and sent some logs to a provisioned port whilst also capturing the packets with tcpdump.

I sent many log lines but only two appeared in the web interface:

```
Jan 26 00:19:28 host0 docker-receive  t=2017-01-26T00:18:48+0000 lvl=dbug msg="registering RPC server" component=containerinit
Jan 26 00:19:28 host0 docker-receive  t=2017-01-26T00:18:48+0000 lvl=info msg="starting the job" component=containerinit args=[/bin/docker-receive]
```

Here is a snippet of the tcpdump which contains both of those log lines, but also some other lines in between which didn't appear:

```
00:19:27.957634 IP xxx.xx.x.230.55604 > 40.71.95.146.xxxxx: Flags [P.], seq 1:219, ack 1, win 211, options [nop,nop,TS val 27603222 ecr 1314780110], length 218
E....4@.@.C.....(G_..4b..h.3J.......;......
..1.N]..214 <0>1 2017-01-26T00:18:48.656703983Z host0 docker-receive app.host0-8a824a35-dd35-4ee0-8697-9bb91edc31b7 ID3 [flynn seq="800"] t=2017-01-26T00:18:48+0000 lvl=dbug msg="registering RPC server" component=containerinit

00:19:27.957671 IP xxx.xx.x.230.55604 > 40.71.95.146.xxxxx: Flags [P.], seq 219:435, ack 1, win 211, options [nop,nop,TS val 27603222 ecr 1314780110], length 216
E....5@.@.C.....(G_..4b..h..J.......;......
..1.N]..212 <0>1 2017-01-26T00:18:48.656785468Z host0 docker-receive app.host0-8a824a35-dd35-4ee0-8697-9bb91edc31b7 ID3 [flynn seq="801"] t=2017-01-26T00:18:48+0000 lvl=dbug msg="creating stdout pipe" component=containerinit

00:19:27.957688 IP xxx.xx.x.230.55604 > 40.71.95.146.xxxxx: Flags [P.], seq 435:651, ack 1, win 211, options [nop,nop,TS val 27603222 ecr 1314780110], length 216
E....6@.@.C.....(G_..4b..h..J.......;......
..1.N]..212 <0>1 2017-01-26T00:18:48.656795096Z host0 docker-receive app.host0-8a824a35-dd35-4ee0-8697-9bb91edc31b7 ID3 [flynn seq="802"] t=2017-01-26T00:18:48+0000 lvl=dbug msg="creating stderr pipe" component=containerinit

...

00:19:28.042239 IP xxx.xx.x.230.55604 > 40.71.95.146.xxxxx: Flags [.], seq 2215:5071, ack 1, win 211, options [nop,nop,TS val 27603243 ecr 1314780195], length 2856
E..\.>@.@.9.....(G_..4b..h..J.......F-.....
..1+N].#235 <0>1 2017-01-26T00:18:48.657344177Z host0 docker-receive app.host0-8a824a35-dd35-4ee0-8697-9bb91edc31b7 ID3 [flynn seq="810"] t=2017-01-26T00:18:48+0000 lvl=info msg="starting the job" component=containerinit args=[/bin/docker-receive]215 <0>1 2017-01-26T00:18:48.65767045Z host0 docker-receive app.host0-8a824a35-dd35-4ee0-8697-9bb91edc31b7 ID3 [flynn seq="811"] t=2017-01-26T00:18:48+0000 lvl=dbug msg="setting state to running" component=containerinit235 <0>1 2017-01-26T00:18:48.657684277Z host0 docker-receive app.host0-8a824a35-dd35-4ee0-8697-9bb91edc31b7 ID3 [flynn seq="812"] t=2017-01-26T00:18:48+0000 lvl=dbug msg="changing state" component=containerinit fn=changeState state=running ...
```

Note that the quotes are *not* escaped when sent over the wire.

Also note that the log lines in the web interface seem to have timestamps representing when they were received by your service, rather than the timestamp in the syslog message (is that expected?).

I hope this helps.

**Comment by mikehu** [comment]
@lmars you are absolutely right. It looks like that was a red herring, sorry about that. That was from log output that was part of a JSON object that got stringified, hence the extra quote escapes.

It turns out there was a problem with our frame sniffing logic which caused some weird offset errors when processing multiple frames within the same TCP buffer.

Thanks for helping us nail down this bug!

In regards to our timestamps, we actually preserve the timestamp of the original syslog time. We only support up to millisecond precision though. Also what you see by default in the web interface is actually local time (with an option to show in UTC), but all data is stored in UTC.

**Comment by RobinDaugherty** [comment]
Everything seems to be perfect sending to LogDNA now.

Still waiting to hear back from Logentries about their bug.

**Comment by josephglanville** [comment]
@RobinDaugherty I think from @lmars enquiry we ascertained they don't actually support RFC6587 framing. In which case #3875 will be required to send logs to Logentries.

**Comment by AlexandrPy** [comment]
Hi! I cannot find any info about the format of the log strings. Currently, it gives me too much useless info. Is there any possibility to change the format?

**Comment by RobinDaugherty** [comment]
You're right @josephglanville I was mistaken about it working. We do get some entries, but it's only a portion of the entries, and I see evidence of a lot of shopped-up entries coming through (where a lot of hostnames show up that are portions of the name of a real host). So @mikehu sorry about being misleading.

**Comment by RipTheJacker** [comment]
@RobinDaugherty could you provide some insight on how you got log-sink working with papertrail? Nothing in my /var/log/flynn matches up with my app ids.
